{
  "model_id" : "testmodel",
  "entities" : [
    {
      "id" : "Customer",
      "weak_entity" : false,
      "attributes" : [
        {
          "name" : "Name",
          "key" : true,
          "weak_key" : false,
          "compounded_value" : false,
          "multi_value" : false,
          "derived_value" : false
        },
        {
          "name" : "Customer-No",
          "key" : false,
          "weak_key" : false,
          "compounded_value" : false,
          "multi_value" : false,
          "derived_value" : false
        }
      ]
    },
    {
      "id" : "Product",
      "weak_entity" : false,
      "attributes" : [
        {
          "name" : "Date",
          "key" : false,
          "weak_key" : false,
          "compounded_value" : false,
          "multi_value" : false,
          "derived_value" : true
        },
        {
          "name" : "Product-No",
          "key" : true,
          "weak_key" : false,
          "compounded_value" : false,
          "multi_value" : false,
          "derived_value" : false
        }
      ]
    }
  ],
  "relationships" : [
    {
      "id" : "rel01",
      "description" : "purchase"
    }
  ],
  "connections" : [
    {
      "id" : "con01",
      "relationship" : "rel01",
      "entity" : "Customer",
      "cardinality" : "1:1"
    },
    {
      "id" : "con02",
      "relationship" : "rel01",
      "entity" : "Product",
      "cardinality" : "1:n"
    }
  ],
  "isa-relationships": [],
  "isa-connections" : []
}